reports/recon/content/json/PORTAL_CKA_ANALYZE_BOSTON_4A5CA3BCE5.json

{"table": "PORTAL_CKA_ANALYZE_BOSTON_4A5CA3BCE5", "rows": 301, "ncols": 20, "profile": {"NEIGHBORHOOD_ID": {"type": "TEXT", "distinct": 63, "blank": 0, "top": [["N_579275502070532581", 28], ["N_568579452955534204", 21], ["N_601230550253966673", 15], ["N_568579452955527921", 14], ["N_601230550253961310", 14], ["N_601230550253965256", 10], ["N_601230550253962329", 10], ["N_601230550253968360", 10], ["N_568579452955538316", 9], ["N_601230550253966945", 8], ["N_601230550253961587", 8], ["N_601230550253961436", 7]], "date_fmt": null}, "NEIGHBORHOOD_NAME": {"type": "TEXT", "distinct": 63, "blank": 0, "top": [["Roxbury", 28], ["Dorchester", 21], ["Downtown Boston - City Hall Plaza and Pavilion", 15], ["Parks", 14], ["Downtown Boston - City Hall - Quincy Market", 14], ["Strand Theatre - Internal", 10], ["BCYF-Vines-CC_ Indoor", 10], ["BCYF-Jackson-Mann-CC_Indoor", 10], ["Hyde Park", 9], ["BCYF-Curley-CC_Indoor", 8], ["BCYF-Tremont", 8], ["East Boston", 7]], "date_fmt": null}, "DEVICE_SERIAL": {"type": "TEXT", "distinct": 305, "blank": 0, "top": [["Q3AK-CQWK-ZYPY", 2], ["Q3AK-CVAW-H5UM", 2], ["Q3KG-VR8G-WJJ6", 2], ["Q3AK-DCRG-BFEQ", 2], ["Q3AK-D6T9-HD45", 2], ["Q3AK-DCY4-BRSV", 2], ["Q2ZY-CKEJ-LDAC", 2], ["Q3AK-VPCA-XAXA", 2], ["Q3AK-DEZB-XZLD", 2], ["Q3AK-D9UD-UJSP", 2], ["Q3KG-W762-97BX", 2], ["Q3AK-CUSV-LHEA", 2]], "date_fmt": null}, "DEVICE_CONNECTEDTO": {"type": "TEXT", "distinct": 296, "blank": 4, "top": [["PARKS-COMMON-AP8", 2], ["PARKS-COMMON-AP9", 2], ["PARKS-FRANKLIN_CLUBHOUSE-MR86-AP1", 2], ["ROX-EMERSON-MR76 AP2", 2], ["ROX-ORCHARD-MR76 AP2", 2], ["DOT-MATHER-MR76 AP2", 2], ["MG41-5", 2], ["MR76-5", 2], ["ROX-ORCHARD-MR76 AP1", 2], ["HP-BFD48-MR76 AP2", 2], ["PARKS-JAMAICAPOND-MR86 AP1", 2]], "date_fmt": null}, "DEVICE_ADDRESS": {"type": "TEXT", "distinct": 105, "blank": 53, "top": [["1663 Columbia Rd, Boston, MA 02127", 12], ["1483 Tremont St Boston, MA", 11], ["Boston Common", 10], ["40 Armington St, Allston, MA 02134", 10], ["345 Bunker Hill St, Boston, MA 02129", 7], ["1 City Hall Plaza, Pavilion\nBoston, MA  02201", 7], ["543 Columbia Rd, Boston, MA 02125", 7], ["68 Annunciation Rd, Mission Hill, MA 02120", 6], ["100 Hebron St, Mattapan, MA 02126", 5], ["1 City Hall Square, Boston, MA 02201", 5], ["18 Barnes Avenue, East Boston, MA 02128", 5]], "date_fmt": null}, "DEVICE_LAT": {"type": "TEXT", "distinct": 89, "blank": 48, "top": [["42.360291326999999", 25], ["42.332229333000001", 14], ["42.329115332000001", 12], ["42.315948335000002", 10], ["42.352047331000001", 10], ["42.381864323000002", 7], ["42.322428334999998", 6], ["42.330141333000000", 6], ["42.334470332999999", 6], ["42.380109322999999", 5], ["42.256296347999999", 5]], "date_fmt": null}, "DEVICE_LONG": {"type": "TEXT", "distinct": 91, "blank": 48, "top": [["-71.058270909000001", 25], ["-71.098239898000003", 14], ["-71.035149919000006", 12], ["-71.065961410000000", 10], ["-71.137700383999999", 10], ["-71.067527405000007", 7], ["-71.090162401000001", 6], ["-71.083664403000000", 6], ["-71.093159400000005", 6], ["-71.061069907000004", 5], ["-71.121081895000003", 5]], "date_fmt": null}, "DEVICE_TAGS": {"type": "TEXT", "distinct": 23, "blank": 0, "top": [["{}", 137], ["{recently-added}", 41], ["{employee}", 37], ["{City-Hall}", 14], ["{employee,recently-added}", 11], ["{bcyf,cob-employee}", 9], ["{BCYF,Inside,UXI,employee}", 8], ["{Inside}", 7], ["{Outside}", 5], ["{Inside,employee}", 5], ["{BPL,Outside,Uphams-Corner-Branch}", 4], ["{BPS,Outside}", 4]], "date_fmt": null}, "ETL_UPDATEDTIMESTAMP": {"type": "TEXT", "distinct": 44, "blank": 0, "top": [["6/19/2026 2:31:40.000", 35], ["6/19/2026 2:31:44.000", 28], ["6/19/2026 2:31:53.000", 17], ["6/19/2026 2:31:54.000", 15], ["6/19/2026 2:31:45.000", 15], ["6/19/2026 2:31:43.000", 13], ["6/19/2026 2:31:55.000", 11], ["6/19/2026 2:31:50.000", 11], ["6/19/2026 2:31:49.000", 10], ["6/19/2026 2:32:13.000", 10], ["6/19/2026 2:31:47.000", 8], ["6/19/2026 2:31:59.000", 8]], "date_fmt": "us"}, "IS_CURRENT": {"type": "TEXT", "distinct": 1, "blank": 0, "top": [["1", 301]], "date_fmt": null}, "ORG1": {"type": "TEXT", "distinct": 5, "blank": 277, "top": [["BCYF", 15], ["BPL", 4], ["BPS", 4], ["DYEE", 1]], "date_fmt": null}, "ORG2": {"type": "TEXT", "distinct": 1, "blank": 301, "top": []}, "INSIDE_OUTSIDE": {"type": "TEXT", "distinct": 3, "blank": 264, "top": [["Inside", 24], ["Outside", 13]], "date_fmt": null}, "LANDMARK": {"type": "TEXT", "distinct": 10, "blank": 201, "top": [["employee", 54], ["City Hall", 14], ["cob employee", 9], ["UXI employee", 8], ["Uphams Corner Branch", 4], ["CoB Employee", 4], ["bcfy employee", 3], ["City Hall employee", 3], ["Curtis Jamaica Plain", 1]], "date_fmt": null}, "SHAPE_WKT": {"type": "TEXT", "distinct": 90, "blank": 48, "top": [["POINT (-71.058270908999987 42.360291327000027)", 25], ["POINT (-71.098239897999974 42.332229333000043)", 14], ["POINT (-71.035149918999934 42.329115332000072)", 12], ["POINT (-71.065961409999943 42.31594833500003)", 10], ["POINT (-71.13770038399997 42.352047331000051)", 10], ["POINT (-71.067527404999964 42.381864323000059)", 7], ["POINT (-71.090162400999986 42.322428335000041)", 6], ["POINT (-71.083664402999943 42.330141333000029)", 6], ["POINT (-71.093159399999934 42.33447033300007)", 6], ["POINT (-71.061069906999933 42.380109323000056)", 5], ["POINT (-71.121081894999975 42.256296348000035)", 5]], "date_fmt": null}, "POINT_X": {"type": "TEXT", "distinct": 91, "blank": 48, "top": [["-71.058270908999987", 25], ["-71.098239897999974", 14], ["-71.035149918999934", 12], ["-71.065961409999943", 10], ["-71.137700383999970", 10], ["-71.067527404999964", 7], ["-71.090162400999986", 6], ["-71.083664402999943", 6], ["-71.093159399999934", 6], ["-71.061069906999933", 5], ["-71.121081894999975", 5]], "date_fmt": null}, "POINT_Y": {"type": "TEXT", "distinct": 90, "blank": 48, "top": [["42.360291327000027", 25], ["42.332229333000043", 14], ["42.329115332000072", 12], ["42.315948335000030", 10], ["42.352047331000051", 10], ["42.381864323000059", 7], ["42.322428335000041", 6], ["42.330141333000029", 6], ["42.334470333000070", 6], ["42.380109323000056", 5], ["42.256296348000035", 5]], "date_fmt": null}, "INGESTED_AT": {"type": "TEXT", "distinct": 1, "blank": 0, "top": [["2026-07-02 21:38:59.748692", 301]], "date_fmt": "iso"}, "SOURCE_RUN_ID": {"type": "TEXT", "distinct": 1, "blank": 0, "top": [["861200ed-8afa-4e13-82d3-7edf428759d0", 301]], "date_fmt": null}, "SRC_SHA256": {"type": "TEXT", "distinct": 1, "blank": 0, "top": [["fb3ff37ed6340ad959beb31c270855bb0397b761b59eabceb1dd4aa9c008a858", 301]], "date_fmt": null}}, "roles": {"NEIGHBORHOOD_ID": ["other"], "NEIGHBORHOOD_NAME": ["who"], "DEVICE_SERIAL": ["other"], "DEVICE_CONNECTEDTO": ["other"], "DEVICE_ADDRESS": ["who"], "DEVICE_LAT": ["who"], "DEVICE_LONG": ["who"], "DEVICE_TAGS": ["category"], "ETL_UPDATEDTIMESTAMP": ["date"], "IS_CURRENT": ["other"], "ORG1": ["category"], "ORG2": ["empty"], "INSIDE_OUTSIDE": ["category"], "LANDMARK": ["category"], "SHAPE_WKT": ["who"], "POINT_X": ["amount"], "POINT_Y": ["amount"], "INGESTED_AT": ["audit", "date"], "SOURCE_RUN_ID": ["audit"], "SRC_SHA256": ["who"]}, "when": {"ETL_UPDATEDTIMESTAMP": [[2026, 301]], "INGESTED_AT": [[2026, 301]]}, "where": {}, "how_big": {"POINT_X": {"n": 253.0, "min": -71.17, "median": -71.07, "p99": -71.01, "max": -71.01, "sum": -17983.4}, "POINT_Y": {"n": 253.0, "min": 42.25, "median": 42.33, "p99": 42.39, "max": 42.39, "sum": 10709.39}}, "who": {"NEIGHBORHOOD_NAME": {"by_rows": [["Roxbury", 28], ["Dorchester", 21], ["Downtown Boston - City Hall Plaza and Pavilion", 15], ["Downtown Boston - City Hall - Quincy Market", 14], ["Parks", 14], ["BCYF-Vines-CC_ Indoor", 10], ["Strand Theatre - Internal", 10], ["BCYF-Jackson-Mann-CC_Indoor", 10], ["Hyde Park", 9], ["BCYF-Curley-CC_Indoor", 8], ["BCYF-Tremont", 8], ["East Boston", 7], ["YEE Tremont", 6], ["Bolling", 6], ["South Boston", 5], ["BCYF-Mattahunt-CC_Indoor", 5], ["East Boston Senior Center", 5], ["Nubian-Bus-Stop", 5], ["Jamaica Plain", 5], ["BCYF-Curley_Outdoor", 4]], "by_sum": [["BCYF-DeepFreeze_test", 1, -71.05], ["BCYF-Gallivan-CC-Indoor", 3, -71.06], ["BCYF-Quincy-CC_Indoor", 1, -71.06], ["BCYF-Vines-CC_ Indoor", 10, -71.08], ["BCYF-Mildred-CC_Indoor", 1, -71.09], ["BCYF-Tobin_CC_Outdoor", 1, -71.1], ["Jamaica Plain", 5, -71.11], ["BCYF-Roche-CC_Indoor", 1, -71.15], ["BCYF-Paris-St-Pool_CC_Indoor", 2, -142.08], ["South Boston", 5, -142.08], ["200-Frontage-RD-TEMPO-APs", 3, -142.12], ["Downtown City Hall Pavilion_Indoor", 2, -142.12], ["BCYF-Leahy-Holloran-CC_Indoor", 2, -142.12], ["BCYF-Charlestown-CC_Indoor", 2, -142.12], ["BCYF-Mason-Pool-CC_Indoor", 2, -142.14], ["Bolling", 6, -142.15], ["OPAT", 2, -142.16], ["BCYF-Tobin_CC_Indoor", 2, -142.17], ["Mattapan-Bus-stop", 2, -142.18], ["BCYF-Flaherty-Pool-CC_Indoor", 2, -142.24]]}, "DEVICE_LONG": {"by_rows": [["-71.058270909000001", 25], ["-71.098239898000003", 14], ["-71.035149919000006", 12], ["-71.065961410000000", 10], ["-71.137700383999999", 10], ["-71.067527405000007", 7], ["-71.093159400000005", 6], ["-71.090162401000001", 6], ["-71.083664403000000", 6], ["-71.061069907000004", 5], ["-71.121081895000003", 5], ["-71.103909899000001", 5], ["-71.076707404999993", 5], ["-71.005970000000005", 5], ["-71.166729879000002", 4], ["-71.101394399000000", 4], ["-71.077908905000001", 3], ["-71.010818423000003", 3], ["-71.067581408999999", 3], ["-71.159574882000001", 3]], "by_sum": [["-71.030199920000001", 1, -71.03], ["-71.054069999999996", 1, -71.05], ["-71.054028868675246", 1, -71.05], ["-71.053272485733046", 1, -71.05], ["-71.053288578987136", 1, -71.05], ["-71.054061055183425", 1, -71.05], ["-71.053267121315017", 1, -71.05], ["-71.061771911999998", 1, -71.06], ["-71.063443422317519", 1, -71.06], ["-71.055750846862807", 1, -71.06], ["-71.064921908000002", 1, -71.06], ["-71.063808202743544", 1, -71.06], ["-71.063936948776259", 1, -71.06], ["-71.061038406999998", 1, -71.06], ["-71.064089999999993", 1, -71.06], ["-71.059260913000003", 1, -71.06], ["-71.055804491043105", 1, -71.06], ["-71.063969135284438", 1, -71.06], ["-71.065535545349135", 1, -71.07], ["-71.066919565200820", 1, -71.07]]}, "DEVICE_LAT": {"by_rows": [["42.360291326999999", 25], ["42.332229333000001", 14], ["42.329115332000001", 12], ["42.315948335000002", 10], ["42.352047331000001", 10], ["42.381864323000002", 7], ["42.330141333000000", 6], ["42.322428334999998", 6], ["42.334470332999999", 6], ["42.326802334000000", 5], ["42.380109322999999", 5], ["42.256296347999999", 5], ["42.275826344000002", 5], ["42.386080000000000", 5], ["42.270768347000001", 4], ["42.292440341000002", 4], ["42.260022349000003", 3], ["42.308829338000002", 3], ["42.349077330999997", 3], ["42.330267333000002", 3]], "by_sum": [["42.332112330999998", 1, -71.03], ["42.373779683456029", 1, -71.05], ["42.358159999999998", 1, -71.05], ["42.373684570469855", 1, -71.05], ["42.373720237856546", 1, -71.05], ["42.360153280620700", 1, -71.05], ["42.360319764108517", 1, -71.05], ["42.355340924400998", 1, -71.06], ["42.300792338000001", 1, -71.06], ["42.381680000000003", 1, -71.06], ["42.360022471856553", 1, -71.06], ["42.360169136209969", 1, -71.06], ["42.347970328999999", 1, -71.06], ["42.297966338000002", 1, -71.06], ["42.380838322999999", 1, -71.06], ["42.355539134157915", 1, -71.06], ["42.355443993552619", 1, -71.06], ["42.355872125142234", 1, -71.07], ["42.352938572443840", 1, -71.07], ["42.299766337999998", 1, -71.07]]}, "DEVICE_ADDRESS": {"by_rows": [["1663 Columbia Rd, Boston, MA 02127", 12], ["1483 Tremont St Boston, MA", 11], ["40 Armington St, Allston, MA 02134", 10], ["Boston Common", 10], ["1 City Hall Plaza, Pavilion\nBoston, MA  02201", 7], ["543 Columbia Rd, Boston, MA 02125", 7], ["345 Bunker Hill St, Boston, MA 02129", 7], ["68 Annunciation Rd, Mission Hill, MA 02120", 6], ["One City Hall Sq  Boston MA 02201", 5], ["100 Hebron St, Mattapan, MA 02126", 5], ["1 City Hall Square, Boston, MA 02201", 5], ["2300 Washington Roxbury", 5], ["18 Barnes Avenue, East Boston, MA 02128", 5], ["339 Dudley St, Roxbury", 4], ["Faneuil Hall Marketplace\nBoston MA 02201", 4], ["430A Canterbury Street, Roslindale, MA 02131", 4], ["2730 Washington St., Boston, MA 02119", 4], ["131 Dale St, Boston, MA 02119", 4], ["1179 River St, Hyde Park, MA 02136", 4], ["25 Warren St, Brighton, MA 02135", 3]], "by_sum": [["745 E 7th St, South Boston, MA 02127", 1, -71.03], ["navy yard cambridge", 1, -71.05], ["1 worrell st Dorchester, ma Basketball Court", 1, -71.05], ["1 worrell st Dorchester, ma", 1, -71.05], ["One Worrell St., Dorchester, MA -  inside admin office", 1, -71.05], ["One City Hall Sq, Pavilion Bld, IWF Room,\nBoston, MA 02201", 1, -71.06], ["One City Hall Sq\nBoston MA 02201", 1, -71.06], ["BPS-Quincy_Elem_232, 885 Washington Street, Boston, MA 02111", 1, -71.06], ["11 Charles St, Dorchester", 1, -71.06], ["One City Hall Sq.  Boston MA 02201", 1, -71.06], ["One City Hall Sq Boston MA 02201", 1, -71.06], ["40 Gibson st, Dorchester, ma", 1, -71.06], ["255 Medford St, Charlestown, MA 02129 (Charlestown Community Center", 1, -71.06], ["543 Columbia Road\nBoston, MA 02125", 1, -71.07], ["35 Westville St., Dorchester, MA", 1, -71.07], ["500 Columbia Rd., Dorchester, MA\n\nBPL-Uphams-Corner\n10.255.255.155\nport 10", 1, -71.07], ["35 Brookford St., Roxbury, MA", 1, -71.08], ["174 Dudley St., Roxbury, MA - Rear Roof Facing Palmer Street", 1, -71.08], ["174 Dudley St., Roxbury, MA - Accross from Engine 14", 1, -71.08], ["Devon & Columbia Rd, Dorchester, MA", 1, -71.08]]}}, "who_x_when": {"NEIGHBORHOOD_NAME": {"date": "ETL_UPDATEDTIMESTAMP", "amount": "POINT_X", "curves": {"200-Frontage-RD-TEMPO-APs": [[2026, 3, -142.12]], "BCYF-Curley-CC_Indoor": [[2026, 8, -568.32]], "BCYF-Curley_Outdoor": [[2026, 4, -284.16]], "BCYF-DeepFreeze_test": [[2026, 1, -71.05]], "BCYF-Gallivan-CC-Indoor": [[2026, 3, -71.06]], "BCYF-Jackson-Mann-CC_Indoor": [[2026, 10, -711.4]], "BCYF-Leahy-Holloran-CC_Indoor": [[2026, 2, -142.12]], "BCYF-Mattahunt-CC_Indoor": [[2026, 5, -355.5]], "BCYF-Mildred-CC_Indoor": [[2026, 1, -71.09]], "BCYF-Paris-St-Pool_CC_Indoor": [[2026, 2, -142.08]], "BCYF-Quincy-CC_Indoor": [[2026, 1, -71.06]], "BCYF-Roche-CC_Indoor": [[2026, 1, -71.15]], "BCYF-Tobin_CC_Outdoor": [[2026, 1, -71.1]], "BCYF-Tremont": [[2026, 8, -426.6]], "BCYF-Vines-CC_ Indoor": [[2026, 10, -71.08]], "Bolling": [[2026, 6, -142.15]], "Dorchester": [[2026, 21, -1492.4]], "Downtown Boston - City Hall - Quincy Market": [[2026, 14, -994.82]], "Downtown Boston - City Hall Plaza and Pavilion": [[2026, 15, -1065.9]], "Downtown City Hall Pavilion_Indoor": [[2026, 2, -142.12]], "East Boston": [[2026, 7, -284.16]], "East Boston Senior Center": [[2026, 5, -355.05]], "Hyde Park": [[2026, 9, -640.03]], "Jamaica Plain": [[2026, 5, -71.11]], "Nubian-Bus-Stop": [[2026, 5, -355.4]], "Parks": [[2026, 14, -852.9]], "Roxbury": [[2026, 28, -1990.27]], "South Boston": [[2026, 5, -142.08]], "Strand Theatre - Internal": [[2026, 10, -497.49]], "YEE Tremont": [[2026, 6, -426.6]]}}, "DEVICE_LONG": {"date": "ETL_UPDATEDTIMESTAMP", "amount": "POINT_X", "curves": {"-71.005970000000005": [[2026, 5, -355.05]], "-71.010818423000003": [[2026, 3, -213.03]], "-71.030199920000001": [[2026, 1, -71.03]], "-71.035149919000006": [[2026, 12, -852.48]], "-71.053267121315017": [[2026, 1, -71.05]], "-71.053272485733046": [[2026, 1, -71.05]], "-71.053288578987136": [[2026, 1, -71.05]], "-71.054028868675246": [[2026, 1, -71.05]], "-71.054061055183425": [[2026, 1, -71.05]], "-71.054069999999996": [[2026, 1, -71.05]], "-71.055750846862807": [[2026, 1, -71.06]], "-71.058270909000001": [[2026, 25, -1776.5]], "-71.061069907000004": [[2026, 5, -355.3]], "-71.061771911999998": [[2026, 1, -71.06]], "-71.063443422317519": [[2026, 1, -71.06]], "-71.065961410000000": [[2026, 10, -710.7]], "-71.067527405000007": [[2026, 7, -497.49]], "-71.067581408999999": [[2026, 3, -213.21]], "-71.076707404999993": [[2026, 5, -355.4]], "-71.077908905000001": [[2026, 3, -213.24]], "-71.083664403000000": [[2026, 6, -426.48]], "-71.090162401000001": [[2026, 6, -426.54]], "-71.093159400000005": [[2026, 6, -426.54]], "-71.098239898000003": [[2026, 14, -995.4]], "-71.101394399000000": [[2026, 4, -284.4]], "-71.103909899000001": [[2026, 5, -355.5]], "-71.121081895000003": [[2026, 5, -355.6]], "-71.137700383999999": [[2026, 10, -711.4]], "-71.159574882000001": [[2026, 3, -213.48]], "-71.166729879000002": [[2026, 4, -284.68]]}}}, "what": {"DEVICE_TAGS": [["{}", 137], ["{recently-added}", 41], ["{employee}", 37], ["{City-Hall}", 14], ["{employee,recently-added}", 11], ["{bcyf,cob-employee}", 9], ["{BCYF,Inside,UXI,employee}", 8], ["{Inside}", 7], ["{Outside}", 5], ["{Inside,employee}", 5], ["{BPL,Outside,Uphams-Corner-Branch}", 4], ["{BPS,Outside}", 4]], "ORG1": [["BCYF", 15], ["BPL", 4], ["BPS", 4], ["DYEE", 1]], "INSIDE_OUTSIDE": [["Inside", 24], ["Outside", 13]], "LANDMARK": [["employee", 54], ["City Hall", 14], ["cob employee", 9], ["UXI employee", 8], ["Uphams Corner Branch", 4], ["CoB Employee", 4], ["bcfy employee", 3], ["City Hall employee", 3], ["Curtis Jamaica Plain", 1]]}, "errors": {}, "seconds": 3.4}

reports/recon/content/pages/PORTAL_CKA_ANALYZE_BOSTON_4A5CA3BCE5.md

## who

NEIGHBORHOOD_NAME by dollars
      -71.05        1 rows  BCYF-DeepFreeze_test
      -71.06        3 rows  BCYF-Gallivan-CC-Indoor
      -71.06        1 rows  BCYF-Quincy-CC_Indoor
      -71.08       10 rows  BCYF-Vines-CC_ Indoor
      -71.09        1 rows  BCYF-Mildred-CC_Indoor
      -71.10        1 rows  BCYF-Tobin_CC_Outdoor
      -71.11        5 rows  Jamaica Plain
      -71.15        1 rows  BCYF-Roche-CC_Indoor
     -142.08        2 rows  BCYF-Paris-St-Pool_CC_Indoor
     -142.08        5 rows  South Boston
     -142.12        3 rows  200-Frontage-RD-TEMPO-APs
     -142.12        2 rows  Downtown City Hall Pavilion_Indoor
     -142.12        2 rows  BCYF-Leahy-Holloran-CC_Indoor
     -142.12        2 rows  BCYF-Charlestown-CC_Indoor
     -142.14        2 rows  BCYF-Mason-Pool-CC_Indoor
     -142.15        6 rows  Bolling
     -142.16        2 rows  OPAT
     -142.17        2 rows  BCYF-Tobin_CC_Indoor
     -142.18        2 rows  Mattapan-Bus-stop
     -142.24        2 rows  BCYF-Flaherty-Pool-CC_Indoor

DEVICE_ADDRESS by dollars
      -71.03        1 rows  745 E 7th St, South Boston, MA 02127
      -71.05        1 rows  navy yard cambridge
      -71.05        1 rows  1 worrell st Dorchester, ma Basketball Court
      -71.05        1 rows  1 worrell st Dorchester, ma
      -71.05        1 rows  One Worrell St., Dorchester, MA -  inside admin office
      -71.06        1 rows  One City Hall Sq, Pavilion Bld, IWF Room,
Boston, MA 02201
      -71.06        1 rows  One City Hall Sq
Boston MA 02201
      -71.06        1 rows  BPS-Quincy_Elem_232, 885 Washington Street, Boston, MA 02111
      -71.06        1 rows  11 Charles St, Dorchester
      -71.06        1 rows  One City Hall Sq.  Boston MA 02201
      -71.06        1 rows  One City Hall Sq Boston MA 02201
      -71.06        1 rows  40 Gibson st, Dorchester, ma
      -71.06        1 rows  255 Medford St, Charlestown, MA 02129 (Charlestown Community
      -71.07        1 rows  543 Columbia Road
Boston, MA 02125
      -71.07        1 rows  35 Westville St., Dorchester, MA
      -71.07        1 rows  500 Columbia Rd., Dorchester, MA