reports/recon/content/json/PORTAL_SOC_NEW_YORK_STATE_O_C08EFA40C8.json

{"table": "PORTAL_SOC_NEW_YORK_STATE_O_C08EFA40C8", "rows": 2000, "ncols": 22, "profile": {"YEAR": {"type": "TEXT", "distinct": 14, "blank": 0, "top": [["2015", 164], ["2010", 162], ["2014", 157], ["2019", 155], ["2011", 152], ["2012", 151], ["2016", 142], ["2013", 140], ["2020", 138], ["2017", 134], ["2018", 132], ["2023", 131]], "date_fmt": null}, "COUNTY": {"type": "TEXT", "distinct": 60, "blank": 0, "top": [["SUFFOLK", 186], ["KINGS", 132], ["ERIE", 122], ["QUEENS", 115], ["NASSAU", 102], ["NEW YORK", 101], ["ALBANY", 83], ["NIAGARA", 82], ["BRONX", 72], ["ORANGE", 70], ["ONONDAGA", 63], ["MONROE", 59]], "date_fmt": null}, "MUNICIPALITY": {"type": "TEXT", "distinct": 336, "blank": 0, "top": [["BROOKLYN", 71], ["BUFFALO", 47], ["NEW YORK", 46], ["HEMPSTEAD", 36], ["NIAGARA FALLS", 36], ["TONAWANDA", 35], ["ROCHESTER", 34], ["ALBANY", 30], ["BRONX", 27], ["BROOKHAVEN", 27], ["RENSSELAER", 26], ["ISLIP", 26]], "date_fmt": null}, "DEC_ID": {"type": "TEXT", "distinct": 455, "blank": 0, "top": [["1282000357", 14], ["4102600037", 12], ["2600700726", 11], ["5154800008", 11], ["2610200005", 11], ["8245200008", 11], ["7355600001", 11], ["9140200696", 11], ["5415400002", 11], ["8245200006", 11], ["8263200225", 11], ["4192200055", 11]], "date_fmt": null}, "FACILITY_NAME": {"type": "TEXT", "distinct": 555, "blank": 0, "top": [["FREEPORT POWER PLANT #1", 14], ["BALL METAL BEVERAGE CONTAINER CORP", 12], ["COMPRESSOR STATION 254", 12], ["HARLEM RIVER YARDS PLANT", 11], ["OWLS HEAD WASTEWATER TREATMENT PLANT", 11], ["TGP COMPRESSOR STATION 233", 11], ["NOVELIS CORPORATION", 11], ["UNICELL BODY COMPANY INC", 11], ["MOMENTIVE PERFORMANCE MATERIALS", 11], ["ARKEMA INC", 11], ["HAMMER PACKAGING CORP", 11], ["ATHENS GENERATING PLANT", 11]], "date_fmt": null}, "SIC_CODE": {"type": "TEXT", "distinct": 123, "blank": 0, "top": [["4911", 463], ["4953", 180], ["8062", 102], ["5171", 100], ["4922", 88], ["4931", 73], ["4952", 60], ["8221", 53], ["6513", 50], ["4226", 34], ["4961", 33], ["2821", 30]], "date_fmt": null}, "VOC": {"type": "TEXT", "distinct": 1252, "blank": 0, "top": [["0", 86], ["0.01", 24], ["0.02", 17], ["0.09", 15], ["0.03", 15], ["0.49", 12], ["0.57", 12], ["3.08", 11], ["0.04", 11], ["0.91", 11], ["0.29", 11], ["0.06", 11]], "date_fmt": null}, "NOX": {"type": "TEXT", "distinct": 1517, "blank": 0, "top": [["0", 120], ["0.01", 22], ["0.06", 14], ["0.33", 11], ["0.05", 11], ["0.34", 11], ["0.17", 11], ["9.88", 10], ["5.37", 10], ["447.37", 10], ["1.35", 10], ["5.9", 10]], "date_fmt": null}, "CO": {"type": "TEXT", "distinct": 1385, "blank": 0, "top": [["0", 138], ["0.01", 26], ["0.03", 16], ["0.02", 14], ["0.08", 12], ["0.04", 12], ["0.06", 11], ["0.05", 11], ["8.3", 10], ["4.45", 10], ["713.78", 10], ["1.14", 10]], "date_fmt": null}, "CO2": {"type": "TEXT", "distinct": 1888, "blank": 0, "top": [["0", 106], ["3.53", 10], ["59326.47", 10], ["596725.26", 10], ["1632.91", 10], ["57232.57", 10], ["34177.76", 10], ["9444.00", 10], ["299.01", 10], ["5363.36", 10], ["1373.07", 10], ["4396.49", 10]], "date_fmt": null}, "PARTICULATES": {"type": "TEXT", "distinct": 898, "blank": 0, "top": [["0", 235], ["0.01", 53], ["0.03", 25], ["0.04", 15], ["0.06", 15], ["0.11", 14], ["0.07", 14], ["0.14", 13], ["0.16", 13], ["0.05", 13], ["0.02", 12], ["0.2", 12]], "date_fmt": null}, "PM10": {"type": "TEXT", "distinct": 611, "blank": 0, "top": [["0", 623], ["0.01", 92], ["0.03", 35], ["0.02", 32], ["0.04", 27], ["0.05", 20], ["0.11", 20], ["0.06", 18], ["0.17", 17], ["0.09", 16], ["0.07", 16], ["0.08", 14]], "date_fmt": null}, "PM2_5": {"type": "TEXT", "distinct": 628, "blank": 0, "top": [["0", 528], ["0.01", 69], ["0.02", 54], ["0.03", 41], ["0.04", 32], ["0.05", 29], ["0.07", 23], ["0.06", 19], ["0.11", 15], ["0.09", 14], ["0.12", 14], ["0.08", 13]], "date_fmt": null}, "HAPS": {"type": "TEXT", "distinct": 401, "blank": 0, "top": [["0", 1237], ["0.01", 40], ["0.02", 20], ["0.04", 13], ["0.07", 10], ["0.03", 10], ["0.09", 10], ["0.05", 9], ["0.08", 8], ["0.1", 8], ["0.12", 8], ["0.22", 7]], "date_fmt": null}, "SO2": {"type": "TEXT", "distinct": 766, "blank": 0, "top": [["0", 298], ["0.01", 111], ["0.03", 59], ["0.02", 55], ["0.05", 40], ["0.04", 39], ["0.06", 36], ["0.1", 29], ["0.17", 23], ["0.13", 23], ["0.09", 22], ["0.16", 21]], "date_fmt": null}, "LOCATION": {"type": "TEXT", "distinct": 301, "blank": 0, "top": [["{\"type\": \"Point\", \"coordinates\": [-73.99036, 40.69245]}", 132], ["{\"type\": \"Point\", \"coordinates\": [-73.82999, 40.714]}", 72], ["{\"type\": \"Point\", \"coordinates\": [-73.92309, 40.826]}", 70], ["{\"type\": \"Point\", \"coordinates\": [-74.00602, 40.71451]}", 55], ["{\"type\": \"Point\", \"coordinates\": [-78.87846, 42.88545]}", 47], ["{\"type\": \"Point\", \"coordinates\": [-74.00712, 40.71453]}", 46], ["{\"type\": \"Point\", \"coordinates\": [-73.62194, 40.7101]}", 36], ["{\"type\": \"Point\", \"coordinates\": [-79.05551, 43.096]}", 36], ["{\"type\": \"Point\", \"coordinates\": [-78.88617, 43.01888]}", 35], ["{\"type\": \"Point\", \"coordinates\": [-77.61632, 43.1558]}", 34], ["{\"type\": \"Point\", \"coordinates\": [-73.75521, 42.65155]}", 30], ["{\"type\": \"Point\", \"coordinates\": [-72.91224, 40.7737]}", 27]], "date_fmt": null}, "COMPUTED_REGION_YAMH_8V7K": {"type": "TEXT", "distinct": 209, "blank": 0, "top": [["894", 132], ["196", 110], ["749", 101], ["62", 73], ["307", 70], ["1022", 66], ["300", 47], ["159", 36], ["1019", 35], ["280", 35], ["537", 34], ["814", 30]], "date_fmt": null}, "COMPUTED_REGION_WBG7_3WHC": {"type": "TEXT", "distinct": 251, "blank": 0, "top": [["880", 132], ["723", 101], ["1162", 72], ["647", 70], ["33", 47], ["1456", 36], ["165", 36], ["8", 35], ["1673", 34], ["44", 30], ["667", 28], ["1076", 27]], "date_fmt": null}, "COMPUTED_REGION_KJDX_G34T": {"type": "TEXT", "distinct": 59, "blank": 0, "top": [["2179", 182], ["2090", 132], ["2041", 122], ["2137", 110], ["2094", 109], ["2095", 101], ["2030", 83], ["2131", 82], ["2032", 70], ["2134", 64], ["2132", 63], ["2093", 58]], "date_fmt": null}, "INGESTED_AT": {"type": "TEXT", "distinct": 1, "blank": 0, "top": [["2026-06-24 05:41:44.380688", 2000]], "date_fmt": "iso"}, "SOURCE_RUN_ID": {"type": "TEXT", "distinct": 1, "blank": 0, "top": [["bfff8854-0a8a-4674-9300-f29f29f6c37c", 2000]], "date_fmt": null}, "SRC_SHA256": {"type": "TEXT", "distinct": 1, "blank": 0, "top": [["9a68f4ff7d218679cef021c89bdfb8bfa53f9cc20475fa45674319e8cf091d2a", 2000]], "date_fmt": null}}, "roles": {"YEAR": ["category"], "COUNTY": ["who"], "MUNICIPALITY": ["who"], "DEC_ID": ["other"], "FACILITY_NAME": ["who"], "SIC_CODE": ["other"], "VOC": ["amount"], "NOX": ["amount"], "CO": ["amount"], "CO2": ["amount"], "PARTICULATES": ["amount"], "PM10": ["amount"], "PM2_5": ["amount"], "HAPS": ["amount"], "SO2": ["amount"], "LOCATION": ["who"], "COMPUTED_REGION_YAMH_8V7K": ["other"], "COMPUTED_REGION_WBG7_3WHC": ["other"], "COMPUTED_REGION_KJDX_G34T": ["other"], "INGESTED_AT": ["audit", "date"], "SOURCE_RUN_ID": ["audit"], "SRC_SHA256": ["who"]}, "when": {"INGESTED_AT": [[2026, 2000]]}, "where": {}, "how_big": {"VOC": {"n": 2000.0, "min": 0.0, "median": 4.865, "p99": 128.235, "max": 314.47, "sum": 32353.15}, "NOX": {"n": 2000.0, "min": 0.0, "median": 13.56, "p99": 1105.19, "max": 4516.01, "sum": 178787.97}, "CO": {"n": 2000.0, "min": 0.0, "median": 8.175, "p99": 1008.0, "max": 13889.19, "sum": 205032.08}, "CO2": {"n": 2000.0, "min": 0.0, "median": 12885.15, "p99": 2172192.46, "max": 4505944.95, "sum": 236710334.88}, "PARTICULATES": {"n": 2000.0, "min": 0.0, "median": 1.615, "p99": 278.185, "max": 5796.37, "sum": 38875.75}, "PM10": {"n": 2000.0, "min": 0.0, "median": 0.185, "p99": 151.225, "max": 756.03, "sum": 15237.65}}, "who": {"FACILITY_NAME": {"by_rows": [["FREEPORT POWER PLANT #1", 14], ["INDEPENDENCE STATION", 10], ["BALL METAL BEVERAGE CONTAINER CORP", 10], ["CALPINE JFK ENERGY CENTER", 8], ["AMERICAN PACKAGING CORP", 8], ["GLOBAL COMPANIES LLC - ALBANY TERMINAL", 7], ["BEECH HILL COMPRESSOR STATION", 7], ["GE GLOBAL RESEARCH CENTER", 7], ["INDECK-CORINTH ENERGY CENTER", 7], ["SOMERSET OPERATING COMPANY LLC", 7], ["FREEPORT POWER PLANT #2", 7], ["VULCRAFT OF NEW YORK INC", 7], ["BORGER STATION", 7], ["UNICELL BODY COMPANY INC", 7], ["NEW YORK PRESBYTERIAN HOSPITAL", 7], ["ARKEMA INC", 7], ["SELKIRK COGENERATION PROJECT", 7], ["NOVELIS CORPORATION", 7], ["PORT JEFFERSON POWER STATION", 7], ["NUCOR STEEL AUBURN INC", 7]], "by_sum": [["PACTIV LLC", 4, 958.82], ["3M TONAWANDA", 5, 700.85], ["BALL METAL BEVERAGE CONTAINER CORP", 10, 689.6], ["METAL CONTAINER CORP", 5, 624.77], ["E I DUPONT YERKES PLANT", 4, 542.81], ["ANHEUSER BUSCH BALDWINSVILLE BREWERY", 6, 525.72], ["GUNLOCKE CO", 5, 485.86], ["GLOBAL COMPANIES LLC - ALBANY TERMINAL", 7, 467.24], ["CON ED-EAST RIVER GENERATING STATION", 6, 461.54], ["PALL TRINITY MICRO", 6, 446.99], ["AMERICAN PACKAGING CORP", 8, 442.99], ["FINCH PAPER LLC", 6, 439.76], ["RAVENSWOOD GENERATING STATION", 6, 414.52], ["EASTMAN BUSINESS PARK", 4, 412.14], ["NORTHPORT POWER STATION", 5, 397.08], ["GLOBAL COMPANIES - CARGO TERMINAL", 5, 384.17], ["GLOBE METALLURGICAL INC", 5, 382.79], ["NOVELIS CORPORATION", 7, 339.94], ["ARKEMA INC", 7, 336.83], ["KINDER MORGAN LIQUIDS TERMINALS LLC", 5, 336.52]]}, "MUNICIPALITY": {"by_rows": [["BROOKLYN", 71], ["BUFFALO", 47], ["NEW YORK", 46], ["NIAGARA FALLS", 36], ["HEMPSTEAD", 36], ["TONAWANDA", 35], ["ROCHESTER", 34], ["ALBANY", 30], ["BRONX", 27], ["BROOKHAVEN", 27], ["ISLIP", 26], ["RENSSELAER", 26], ["NEW WINDSOR", 26], ["BROOKLYN (6101)", 22], ["AUBURN", 22], ["OSWEGO", 20], ["QUEENS (6301)", 19], ["BRONX (6005)", 17], ["MANHATTAN (6204)", 17], ["BABYLON", 17]], "by_sum": [["TONAWANDA", 35, 1900.21], ["NEW WINDSOR", 26, 1273.0], ["ROCHESTER", 34, 1169.67], ["CANANDAIGUA", 8, 960.19], ["BUFFALO", 47, 868.38], ["SARATOGA SPRINGS", 9, 725.54], ["ALBANY", 30, 702.1], ["NIAGARA FALLS", 36, 497.17], ["WAYLAND", 5, 485.86], ["GLENS FALLS", 12, 471.28], ["TICONDEROGA", 4, 461.22], ["BALDWINSVILLE", 5, 438.49], ["NEW YORK", 46, 436.63], ["HEMPSTEAD", 36, 433.88], ["BROOKLYN", 71, 420.28], ["RENSSELAER", 26, 398.73], ["MIDDLETOWN", 16, 394.12], ["CORTLAND", 5, 382.4], ["HUNTINGTON", 10, 368.24], ["QUEENS (6301)", 19, 365.76]]}, "LOCATION": {"by_rows": [["{\"type\": \"Point\", \"coordinates\": [-73.99036, 40.69245]}", 132], ["{\"type\": \"Point\", \"coordinates\": [-73.82999, 40.714]}", 72], ["{\"type\": \"Point\", \"coordinates\": [-73.92309, 40.826]}", 70], ["{\"type\": \"Point\", \"coordinates\": [-74.00602, 40.71451]}", 55], ["{\"type\": \"Point\", \"coordinates\": [-78.87846, 42.88545]}", 47], ["{\"type\": \"Point\", \"coordinates\": [-74.00712, 40.71453]}", 46], ["{\"type\": \"Point\", \"coordinates\": [-79.05551, 43.096]}", 36], ["{\"type\": \"Point\", \"coordinates\": [-73.62194, 40.7101]}", 36], ["{\"type\": \"Point\", \"coordinates\": [-78.88617, 43.01888]}", 35], ["{\"type\": \"Point\", \"coordinates\": [-77.61632, 43.1558]}", 34], ["{\"type\": \"Point\", \"coordinates\": [-73.75521, 42.65155]}", 30], ["{\"type\": \"Point\", \"coordinates\": [-72.91224, 40.7737]}", 27], ["{\"type\": \"Point\", \"coordinates\": [-73.74127, 42.64472]}", 26], ["{\"type\": \"Point\", \"coordinates\": [-74.02274, 41.47742]}", 26], ["{\"type\": \"Point\", \"coordinates\": [-73.218, 40.72817]}", 26], ["{\"type\": \"Point\", \"coordinates\": [-74.07527, 40.64242]}", 25], ["{\"type\": \"Point\", \"coordinates\": [-76.56591, 42.92936]}", 22], ["{\"type\": \"Point\", \"coordinates\": [-76.51119, 43.45646]}", 20], ["{\"type\": \"Point\", \"coordinates\": [-73.32601, 40.69573]}", 17], ["{\"type\": \"Point\", \"coordinates\": [-74.42261, 41.44584]}", 16]], "by_sum": [["{\"type\": \"Point\", \"coordinates\": [-78.88617, 43.01888]}", 35, 1900.21], ["{\"type\": \"Point\", \"coordinates\": [-74.02274, 41.47742]}", 26, 1273.0], ["{\"type\": \"Point\", \"coordinates\": [-77.61632, 43.1558]}", 34, 1169.67], ["{\"type\": \"Point\", \"coordinates\": [-73.82999, 40.714]}", 72, 1055.47], ["{\"type\": \"Point\", \"coordinates\": [-73.99036, 40.69245]}", 132, 975.03], ["{\"type\": \"Point\", \"coordinates\": [-77.28094, 42.88809]}", 8, 960.19], ["{\"type\": \"Point\", \"coordinates\": [-78.87846, 42.88545]}", 47, 868.38], ["{\"type\": \"Point\", \"coordinates\": [-73.78441, 43.08412]}", 9, 725.54], ["{\"type\": \"Point\", \"coordinates\": [-73.75521, 42.65155]}", 30, 702.1], ["{\"type\": \"Point\", \"coordinates\": [-74.07527, 40.64242]}", 25, 627.18], ["{\"type\": \"Point\", \"coordinates\": [-79.05551, 43.096]}", 36, 497.17], ["{\"type\": \"Point\", \"coordinates\": [-77.58991, 42.56779]}", 5, 485.86], ["{\"type\": \"Point\", \"coordinates\": [-73.64375, 43.31128]}", 12, 471.28], ["{\"type\": \"Point\", \"coordinates\": [-73.42423, 43.84879]}", 4, 461.22], ["{\"type\": \"Point\", \"coordinates\": [-74.00602, 40.71451]}", 55, 445.76], ["{\"type\": \"Point\", \"coordinates\": [-76.33276, 43.15867]}", 5, 438.49], ["{\"type\": \"Point\", \"coordinates\": [-74.00712, 40.71453]}", 46, 436.63], ["{\"type\": \"Point\", \"coordinates\": [-73.62194, 40.7101]}", 36, 433.88], ["{\"type\": \"Point\", \"coordinates\": [-73.74127, 42.64472]}", 26, 398.73], ["{\"type\": \"Point\", \"coordinates\": [-74.42261, 41.44584]}", 16, 394.12]]}, "COUNTY": {"by_rows": [["SUFFOLK", 186], ["KINGS", 132], ["ERIE", 122], ["QUEENS", 115], ["NASSAU", 102], ["NEW YORK", 101], ["ALBANY", 83], ["NIAGARA", 82], ["BRONX", 72], ["ORANGE", 70], ["ONONDAGA", 63], ["MONROE", 59], ["WESTCHESTER", 46], ["OSWEGO", 43], ["ROCKLAND", 40], ["RENSSELAER", 35], ["JEFFERSON", 34], ["CHAUTAUQUA", 33], ["ONTARIO", 31], ["STEUBEN", 30]], "by_sum": [["ERIE", 122, 3594.5], ["ALBANY", 83, 1906.58], ["ORANGE", 70, 1882.61], ["MONROE", 59, 1774.89], ["ONTARIO", 31, 1759.96], ["SUFFOLK", 186, 1714.06], ["QUEENS", 115, 1420.57], ["ONONDAGA", 63, 1405.63], ["NASSAU", 102, 1175.05], ["SARATOGA", 27, 1140.35], ["KINGS", 132, 975.03], ["NEW YORK", 101, 882.39], ["NIAGARA", 82, 855.21], ["STEUBEN", 30, 764.37], ["RICHMOND", 26, 634.57], ["CHEMUNG", 27, 628.09], ["WAYNE", 20, 559.34], ["RENSSELAER", 35, 515.48], ["SENECA", 11, 487.17], ["WARREN", 12, 471.28]]}}, "who_x_when": {"FACILITY_NAME": {"date": "INGESTED_AT", "amount": "VOC", "curves": {"3M TONAWANDA": [[2026, 5, 700.85]], "AMERICAN PACKAGING CORP": [[2026, 8, 442.99]], "ANHEUSER BUSCH BALDWINSVILLE BREWERY": [[2026, 6, 525.72]], "ARKEMA INC": [[2026, 7, 336.83]], "BALL METAL BEVERAGE CONTAINER CORP": [[2026, 10, 689.6]], "BEECH HILL COMPRESSOR STATION": [[2026, 7, 79.72]], "BORGER STATION": [[2026, 7, 5.84]], "CALPINE JFK ENERGY CENTER": [[2026, 8, 115.76]], "CON ED-EAST RIVER GENERATING STATION": [[2026, 6, 461.54]], "E I DUPONT YERKES PLANT": [[2026, 4, 542.81]], "FINCH PAPER LLC": [[2026, 6, 439.76]], "FREEPORT POWER PLANT #1": [[2026, 14, 1.3]], "FREEPORT POWER PLANT #2": [[2026, 7, 19.42]], "GE GLOBAL RESEARCH CENTER": [[2026, 7, 37.52]], "GLOBAL COMPANIES LLC - ALBANY TERMINAL": [[2026, 7, 467.24]], "GUNLOCKE CO": [[2026, 5, 485.86]], "INDECK-CORINTH ENERGY CENTER": [[2026, 7, 91.34]], "INDEPENDENCE STATION": [[2026, 10, 312.89]], "METAL CONTAINER CORP": [[2026, 5, 624.77]], "NEW YORK PRESBYTERIAN HOSPITAL": [[2026, 7, 24.31]], "NOVELIS CORPORATION": [[2026, 7, 339.94]], "NUCOR STEEL AUBURN INC": [[2026, 7, 28.64]], "PACTIV LLC": [[2026, 4, 958.82]], "PALL TRINITY MICRO": [[2026, 6, 446.99]], "PORT JEFFERSON POWER STATION": [[2026, 7, 86.68]], "RAVENSWOOD GENERATING STATION": [[2026, 6, 414.52]], "SELKIRK COGENERATION PROJECT": [[2026, 7, 88.74]], "SOMERSET OPERATING COMPANY LLC": [[2026, 7, 97.12]], "UNICELL BODY COMPANY INC": [[2026, 7, 61.36]], "VULCRAFT OF NEW YORK INC": [[2026, 7, 163.19]]}}, "MUNICIPALITY": {"date": "INGESTED_AT", "amount": "VOC", "curves": {"ALBANY": [[2026, 30, 702.1]], "AUBURN": [[2026, 22, 251.27]], "BABYLON": [[2026, 17, 58.37]], "BALDWINSVILLE": [[2026, 5, 438.49]], "BRONX": [[2026, 27, 62.45]], "BRONX (6005)": [[2026, 17, 26.89]], "BROOKHAVEN": [[2026, 27, 189.79]], "BROOKLYN": [[2026, 71, 420.28]], "BROOKLYN (6101)": [[2026, 22, 325.87]], "BUFFALO": [[2026, 47, 868.38]], "CANANDAIGUA": [[2026, 8, 960.19]], "CORTLAND": [[2026, 5, 382.4]], "GLENS FALLS": [[2026, 12, 471.28]], "HEMPSTEAD": [[2026, 36, 433.88]], "HUNTINGTON": [[2026, 10, 368.24]], "ISLIP": [[2026, 26, 236.72]], "MANHATTAN (6204)": [[2026, 17, 98.73]], "MIDDLETOWN": [[2026, 16, 394.12]], "NEW WINDSOR": [[2026, 26, 1273.0]], "NEW YORK": [[2026, 46, 436.63]], "NIAGARA FALLS": [[2026, 36, 497.17]], "OSWEGO": [[2026, 20, 203.41]], "QUEENS (6301)": [[2026, 19, 365.76]], "RENSSELAER": [[2026, 26, 398.73]], "ROCHESTER": [[2026, 34, 1169.67]], "SARATOGA SPRINGS": [[2026, 9, 725.54]], "TICONDEROGA": [[2026, 4, 461.22]], "TONAWANDA": [[2026, 35, 1900.21]], "WAYLAND": [[2026, 5, 485.86]]}}}, "what": {"YEAR": [["2015", 164], ["2010", 162], ["2014", 157], ["2019", 155], ["2011", 152], ["2012", 151], ["2016", 142], ["2013", 140], ["2020", 138], ["2017", 134], ["2018", 132], ["2023", 131]]}, "errors": {}, "seconds": 5.0}

reports/recon/content/pages/PORTAL_SOC_NEW_YORK_STATE_O_C08EFA40C8.md

## who

MUNICIPALITY by dollars
        1.9K       35 rows  TONAWANDA
        1.3K       26 rows  NEW WINDSOR
        1.2K       34 rows  ROCHESTER
      960.19        8 rows  CANANDAIGUA
      868.38       47 rows  BUFFALO
      725.54        9 rows  SARATOGA SPRINGS
      702.10       30 rows  ALBANY
      497.17       36 rows  NIAGARA FALLS
      485.86        5 rows  WAYLAND
      471.28       12 rows  GLENS FALLS
      461.22        4 rows  TICONDEROGA
      438.49        5 rows  BALDWINSVILLE
      436.63       46 rows  NEW YORK
      433.88       36 rows  HEMPSTEAD
      420.28       71 rows  BROOKLYN
      398.73       26 rows  RENSSELAER
      394.12       16 rows  MIDDLETOWN
      382.40        5 rows  CORTLAND
      368.24       10 rows  HUNTINGTON
      365.76       19 rows  QUEENS (6301)

LOCATION by rows
       132  {"type": "Point", "coordinates": [-73.99036, 40.69245]}
        72  {"type": "Point", "coordinates": [-73.82999, 40.714]}
        70  {"type": "Point", "coordinates": [-73.92309, 40.826]}
        55  {"type": "Point", "coordinates": [-74.00602, 40.71451]}
        47  {"type": "Point", "coordinates": [-78.87846, 42.88545]}
        46  {"type": "Point", "coordinates": [-74.00712, 40.71453]}
        36  {"type": "Point", "coordinates": [-79.05551, 43.096]}
        36  {"type": "Point", "coordinates": [-73.62194, 40.7101]}
        35  {"type": "Point", "coordinates": [-78.88617, 43.01888]}
        34  {"type": "Point", "coordinates": [-77.61632, 43.1558]}
        30  {"type": "Point", "coordinates": [-73.75521, 42.65155]}
        27  {"type": "Point", "coordinates": [-72.91224, 40.7737]}
        26  {"type": "Point", "coordinates": [-73.74127, 42.64472]}
        26  {"type": "Point", "coordinates": [-74.02274, 41.47742]}
        26  {"type": "Point", "coordinates": [-73.218, 40.72817]}
        25  {"type": "Point", "coordinates": [-74.07527, 40.64242]}
        22  {"type": "Point", "coordinates": [-76.56591, 42.92936]}
        20  {"type": "Point", "coordinates": [-76.51119, 43.45646]}
        17  {"type": "Point", "coordinates": [-73.32601, 40.69573]}
        16  {"type": "Point", "coordinates": [-74.42261, 41.44584]}

LOCATION by dollars
        1.9K       35 rows  {"type": "Point", "coordinates": [-78.88617, 43.01888]}
        1.3K       26 rows  {"type": "Point", "coordinates": [-74.02274, 41.47742]}
        1.2K       34 rows  {"type": "Point", "coordinates": [-77.61632, 43.1558]}
        1.1K       72 rows  {"type": "Point", "coordinates": [-73.82999, 40.714]}
      975.03      132 rows  {"type": "Point", "coordinates": [-73.99036, 40.69245]}
      960.19        8 rows  {"type": "Point", "coordinates": [-77.28094, 42.88809]}
      868.38       47 rows  {"type": "Point", "coordinates": [-78.87846, 42.88545]}
      725.54        9 rows  {"type": "Point", "coordinates": [-73.78441, 43.08412]}
      702.10       30 rows  {"type": "Point", "coordinates": [-73.75521, 42.65155]}
      627.18       25 rows  {"type": "Point", "coordinates": [-74.07527, 40.64242]}
      497.17       36 rows  {"type": "Point", "coordinates": [-79.05551, 43.096]}
      485.86        5 rows  {"type": "Point", "coordinates": [-77.58991, 42.56779]}
      471.28       12 rows  {"type": "Point", "coordinates": [-73.64375, 43.31128]}
      461.22        4 rows  {"type": "Point", "coordinates": [-73.42423, 43.84879]}
      445.76       55 rows  {"type": "Point", "coordinates": [-74.00602, 40.71451]}
      438.49        5 rows  {"type": "Point", "coordinates": [-76.33276, 43.15867]}
      436.63       46 rows  {"type": "Point", "coordinates": [-74.00712, 40.71453]}
      433.88       36 rows  {"type": "Point", "coordinates": [-73.62194, 40.7101]}
      398.73       26 rows  {"type": "Point", "coordinates": [-73.74127, 42.64472]}
      394.12       16 rows  {"type": "Point", "coordinates": [-74.42261, 41.44584]}

COUNTY by dollars
        3.6K      122 rows  ERIE
        1.9K       83 rows  ALBANY
        1.9K       70 rows  ORANGE
        1.8K       59 rows  MONROE
        1.8K       31 rows  ONTARIO
        1.7K      186 rows  SUFFOLK
        1.4K      115 rows  QUEENS
        1.4K       63 rows  ONONDAGA
        1.2K      102 rows  NASSAU
        1.1K       27 rows  SARATOGA
      975.03      132 rows  KINGS
      882.39      101 rows  NEW YORK
      855.21       82 rows  NIAGARA
      764.37       30 rows  STEUBEN
      634.57       26 rows  RICHMOND
      628.09       27 rows  CHEMUNG
      559.34       20 rows  WAYNE
      515.48       35 rows  RENSSELAER
      487.17       11 rows  SENECA
      471.28       12 rows  WARREN